Che Fico,https://www.chefico.com/,San Francisco,NOPA,California-Italian,"Highly suggest if you want comfort food paired with a good wine selection. The open space kitchen and high ceiling layout makes me feel like I’m visiting a family cabin, with meals coming straight out of a wood fired oven","Focaccia w/ whipped mascarpone, Polpo (octopus), Pizza: Amatriciana and Zucca (they also have pineapple pizza), Lasagna, Angelo Arosto (lamb)","Not required, but recommended",~A month,$$$ - $51-$100
Third Culture Bakery,http://www.thirdculturebakery.com/,Berkeley,West Berkeley,Asian fusion mochi desserts,Mochi donuts. This is my stop when I want something sweet and comforting after a long week. Bonus points to the staff who has given me free donuts in the past. ,The black sesame mochi donut and the matcha latte,Just pull up!,N/A,$ - $0-$20
East Bay Spice,https://eastbayspiceco.com/?utm_source=google,Berkeley,Downtown Berkeley,Indian,"The flavorful and strong cocktails, the dark and sexy ambience, and the great playlist. I suggest this spot for catching up with a friend or for date night.",Get the “Mango Daddy” cocktail if you like ginger and citrus forward cocktails—this one is Smokey because of mezcal. Save room for the tikka masala flatbread.,Walk-in only/no reservations,N/A,$$ - $21-$50
Palawan,https://pakwanrestaurant.com/,San Francisco,Mission District,Pakistani and Indian,"The flavor, spice, and portion sizes. Great place to go when you’re really hungry or after getting drinks in the mission.","Saag paneer, chicken biryani, and chicken tikka masala",Walk-in only/no reservations,Walk-in only/no reservations,$$ - $21-$50
Yuanbao Jiaozi,yuanbaojiaozisf.com,San Francisco,Outer Richmond ,Chinese ,DUMPLINGS!!! ,Any dumplings. And beef noodle soup ,Just pull up!,,$ - $0-$20
Happy family gourmet,happyfamilygourmetca.com,San Francisco,Outer Sunset,Chinese,"FOOD! Very much a local spot, no frills. Incredible food. Cannot stress enough. ",Xian cold noodles are an absolute must order. ,Just pull up!,,$ - $0-$20
Manchego ,https://manchegokoko.com/,Brooklyn,Ditmas Park,Japanese/Spanish Tapas,"This is the go to neighborhood spot that your new girlfriend, mom, and rowdy best friend will love! The combinations shouldn’t make sense- deep broth ramen and charred octapus on the same menu is a lot. But like the melting pot that is Ditmas Park/ Flatbush, this restaurant recognizes that one thing unites us all- flavor! Everything hits in your mouth and wants you to take that second bite. Also the drinks are neighborhood level strong. ","Chorizo, sangria, ramen ",Just pull up!,,$$ - $21-$50
Taqueria el buen sabor,https://maps.app.goo.gl/AtyY97ipCLhvzxnd8?g_st=ipc,San Francisco ,Mission ,Mexican ,"I’ve lived in San Francisco my entire life aside from college and I’ve been getting the burritos here the entire time. It’s a sleeper because people think if it’s on Valencia, it must be a yuppie location, but I’ll be honest. They have the softest flower tortillas, the ratios of ingredients are insane, they crisp up the Carnitas like no one else, I can’t recommend this place enough. And if the two sauces they have on offer aren’t spicy enough for your liking, ask for the “taco Salsa“",Carnitas burrito,Just pull up!,,$ - $0-$20
Dolores Deluxe,http://www.doloresdeluxe.com/,San Francisco,Mission / Noe,Deli / sandwiches,"Unassuming corner store with amazing gourmet sandwiches, pastries, and prepared food, and super nice staff",Call Me Serge,Walk-in only/no reservations,,$ - $0-$20
El Gallo Giro ,NA,San Francisco,Mission,Mexican,Lunch-only food truck probably has the best tacos and burritos in the Mission. ,Carnitas,Just pull up!,,$ - $0-$20
Rite Spot,http://www.ritespotcafe.net/,San Francisco,Mission,Dive Bar / Italian,"One of the most unique vibes of any places in SF. Combo dive bar / white tablecloth italian restaurant (food is just so-so), ecletic live music every night, ecletic local crowd of regulars.",Dive bar stuff / basic food,Walk-in only/no reservations,,$$ - $21-$50
Ravagh persian grill,https://www.ravaghrestaurants.com/,NYC,Upper east side,Persian,"Great appetizers and entrees, good for large groups, not hard to get in","Barg kebob, koobideh kebob",Reservations recommended for weekends,,$$ - $21-$50
Huda,https://hudabrooklyn.com/,New York City,East Williamsburg,“New Levantine”,"Delicious small plates with a menu that changes often (and is always amazing). Cozy in the winter, sidewalk seating in the summer, not fussy! Also great for an event - did a birthday dinner here for 20 and it was so easy and perfect. ","Sour cherry meatballs, batata harra. (Strangely, skip the charred eggplant)","Not required, but recommended",,$$ - $21-$50
Traif,https://traifny.com/,New York City,Williamsburg,Meat-forward American,"They have a set menu that is the best value in NYC. it’s like $60, you get a ton of dishes, and they’re all amazing. Cute little back garden in the summer. I always take out of town visitors here, and you can usually get in on pretty short notice. ","Strawberry ribs, beignets, but really do the set menu and let them guide you","Yes, required",A few days,$$$ - $51-$100
Istanbul Clinton Hill Mediterranean Gyro & Grill,https://www.istanbulclintonhill.com/,Nyc,Clinton Hill,Turkish,"Family owned, friendly staff, generous portion sizes",Chicken Adana Kebab,Just pull up!,,$ - $0-$20
Harts,https://www.hartsbrooklyn.com/,NYC,Crown Heights,"Mediterranean, New American","Small, cozy, friendly neighborhood spot -- perfect for a chilly night","Menu rotates but a constant is the lamb burger -- add the optional anchovies, trust me","Not required, but recommended",A couple days,$$ - $21-$50
L'artusi,https://www.lartusi.com/,NYC,West Village,Italian,"Love sitting at the long bar -- this place used to be trendier, but is still has great good & a great vibe IMO",I'm a sucker for Cacio e Pepe,"Not required, but recommended",A couple days,$$$ - $51-$100
Cafe Rue Dix,https://www.ruedixbrooklyn.com/cafe,NYC,Crown Heights,Senegalese,"A very casual, very delicious, no frills spot",They probably have my most ordered burger in the city + their overripe plantains are the only ones that hold a candle to my mother's,"Not required, but recommended","Pretty chill, lots of openings every day",$$ - $21-$50
Yemenat,https://www.yemenat.rest/,New York City,"Bay Ridge, Brooklyn",Yemeni,"The BEST Yemeni in the city hands down. No frills, but their dishes are consistently excellent. Authentic, reasonably priced, and a great group trek so you can try all the great dishes","Shafoot, muva fish, beef fahsa, lamb haneeth",Just pull up!,,$$ - $21-$50
Fish Cheeks,https://www.fishcheeksnyc.com/,NYC,NoHo,Thai,Kind of trendy but very worth it -- for the seafood & curry lovers,Coconut Crab Curry is the must-do,"Not required, but recommended",Couple days,$$ - $21-$50
The Nuaa Table,http://www.thenuaatable.com/,New York,"Prospect Heights, Brooklyn",Thai,"Calm, intimate setting with great aesthetic in the evenings. Date night friendly. Great customer service, yummy cocktails, and food doesn't disappoint  ","Short Ribs Massaman Curry, Roasted Duck Buns","Not required, but recommended",,$$$ - $51-$100
Chicky's General Stors,https://www.chickysgeneralstore.com/,NYC,Bed-Stuy,"Breakfast Sandwiches, Sandwiches, Light Groceries, Dry Goods","This place has some of the best sandwiches in the neighborhood, it's an every weekend staple for many of our crew in Bed-Stuy","Bacon, Egg, & Cheese on Brioche; Turkey Club",Just pull up!,None needed,$ - $0-$20
Le Paris Dakar,http://www.leparisdakar.com/,New York City,"Bedstuy, Brooklyn","French, Senegalese","Great cafe to read, work, or for a friend catchup! Afrobeats always playing, friendly staff, and crepes are YUM! ",Prosciutto brie apple crepes,Just pull up!,,$ - $0-$20
Chinta Thai,https://www.chintathai.com/,NYC,Greenpoint,Thai,Truly one of the friendliest places in NYC I've eaten -- the food is amazing & the staff has been so kind when I've gone, Ka Praw Moo Krob -- delicious pork belly & rice,"Not required, but recommended",A day if that,$$ - $21-$50
Milk & Pull,https://www.milkandpull.com/,NYC,Bed Stuy,"Cafe, Sandwiches",Another most weekend staple -- the food here is bomb & cozy little backyard in the summer when weather is nice,Breakfast burrito; chai latte,Just pull up!,No need,$ - $0-$20
Shawarma Mia,shawarma-mia.com,Brooklyn,Prospect Heights / Park Slope,"Turkish, Mediterranean ","Reliable fast casual spot that LOADS you up, has unlimited toppings, and excellent chicken shawarma. There are no vibes here, just a top notch neighborhood takeout place. ",Chicken shawarma bowl,Just pull up!,,$ - $0-$20