Restaurant Name,Website Link,City:,Neighborhood/Area,Cuisine Type,What do you love about this place?,"What are your ""Must Have"" recommendations""?",Reservation needed/required?,How far in advance do we need to plan?,Price Range
Ollei,https://maps.app.goo.gl/5HMYExhEcpbCQvyL9?g_st=ipc,San Francisco,Russian Hill,Korean ,Food is absolutely fantastic,Kimchi Fried Rice ,Walk-in only/no reservations,Sometimes they have a wait ,$$ - $21-$50
Pizzaiolo,https://www.pizzaiolooakland.com,Oakland,Temescal,"Californian,Italian","Rotating menus that highlight the best of the current season. Don't go just for pizza - the salads, pastas, entrees, and especially dessers are where Pizzaiolo truly shines. Almost everything is cooked in their wood-fired pizza oven (hence the name, which in Italian means ""in the style of pizza""). Their breakfast offerings are also remarkable!","The menu changes frequently so nothing is guaranteed, but I've had no bad dishes here. Some particular highlights include their meatballs, fried chicken, persimmon and fennel salad, pork coppa, pepperoni and jalapeño pizza, and ricotta donuts (particularly with their housemade almond and fig gelato during the summertime). For breakfast, I recommend the savory porridge or biscuits and gravy.",Walk-in only/no reservations,"All tables are walk-in only but check their website beforehand because they sometimes take limited reservations for holidays or will be closed to host weddings or other private events. In the summer, patio seating fills up quickly after opening.",$$ - $21-$50
Speedy Burritos,NA,Reno,Midtown ,Mexican,Cheesy name but best burritos in town. Recommend carne asada,Carne asada burrito,Just pull up!,NA,$ - $0-$20
Burma Superstar,https://www.burmasuperstar.com/,San Francisco ,Richmond,Southeast Asian,"The superstar shrimp and Burmese style lamb curry are truly like having a bite from my Malaysian grandmother’s kitchen. Super authentic southeast Asian taste, mashing together Malay, Thai, Singapore, and Chinese cuisine in an epic menu! ","Superstar shrimp, Burmese style lamb curry, roti platha, tea leaf salad, spicy and crispy chicken, vegetable samosa",Walk-in only/no reservations,Go on the earlier side during a week day to get a spot! The service is fast but always a popular spot ,$$ - $21-$50
The Tyger,https://www.thetygernyc.com/,NYC,"Manhattan, Chinatown/SoHo",Asian,Everything is sharable and delicious. Fantastic mocktails. Reservations are not impossible,"Fried Chicken, Crab Fried Rice, Grilled Beef Skewer, Baby Gem Salad, Crispy Lamb Ribs, Snapper","Not required, but recommended",Two days to be safe but highly variable,$$$ - $51-$100
Bombera,https://www.bomberaoakland.com,Oakland,Dimond,Mexican,"Coming from a SoCal snob, this is the best Mexican food in the Bay Area. Super flavorful and elevated in just the right way. The vibe is awesome too - built into an old fire station with high ceilings and lots of indoor and outdoor seating.","Spicy carrots, trout tostadas, quesadilla with braised pork, grilled swordfish, carne asada huarache","Not required, but recommended","Peak dinner time reservations book out a few days in advance. Same-day availability is usually possible, but recommend booking a week in advance.",$$$ - $51-$100
Yuanbao Jiao Zi,yuanbaojiaozisf.com,San Francisco,Inner Sunset,"Chinese, Dumplings","These are my favorite dumplings I've ever had in a restaurant, and the closest to tasting like my mom's home cooked dumplings. It is no frills, all dumplings are handmade, and the price is super reasonable. ","Napa cabbage and pork is the OG dumpling type! If you don't eat red meat, the chicken is a good alternative.",Walk-in only/no reservations,"First come first serve, but it's not usually too long of a wait, though maybe 15-30 minutes tops. ",$$ - $21-$50
Noeteca Wine and Bar ,https://maps.app.goo.gl/xHbKzHsEmLFKZFcZ6?g_st=ic,San Francisco ,Near Dolores park ,Brazilian ," I’m a native Brazilian, and I can honestly say this is truly authentic, homemade Brazilian food. It’s the kind of meal that tastes like something your grandma would make, if your grandma were Brazilian. Every time I eat there, it feels like my mom cooked the meal for me. It genuinely feels like home. If you want to experience what Brazilian food is like when it’s made by Brazilians, this is the place. On top of that, the owner is incredibly friendly and treats you like family.",Feijoada ,Walk-in only/no reservations,Just show up. It’s pretty cheap too. Cheaper than normal Brazilian places ,$$ - $21-$50
Heirloom Café,https://heirloom-sf.com/,San Francisco,Mission,California,"Heirloom Café is one of those places that feels instantly comforting and effortlessly special. Deeply rooted in its neighborhood, it offers a seasonal menu that evolves throughout the year, showcasing creative, beautifully executed dishes. Pair that with a fantastic wine selection, and you have a restaurant that delivers every single time. A true local favorite that never disappoints.","The menu is always changing, and it never disappoints.","Yes, required",2 weeks,$$$ - $51-$100
Blue willow,https://www.bluewillownyc.com/,Manhattan,Midtown,Szechuan,Really great dry pot and good drinks,Dry pot! Must have lotus root,"Not required, but recommended",,$$ - $21-$50
Nickie’s,NICKIESBARSF.com,San Francisco ,Lower Haight ,Pub food,"This is a no-frills sports bar that just has all around good pub food but the thing to get here is the chicken tenders. These puppies come with barbecue sauce and ranch included (like you don’t even have to ask for it!!) and a killer side of fries. Basic I know, but this is a great happy hour spot to grab some thing to eat after our workout class at core power or before you hit Motown Monday at Madrones. Salty and good- they usually have booths open and the same locals at the bar everyday. ",Chicky Tendies,Just pull up!,NA,$$ - $21-$50
The Front Porch ,https://www.thefrontporchsf.com/,San Francisco ,Mission ,Southern ,Reminds me of New Orleans ,Shrimp and grits ,"Not required, but recommended",,$$ - $21-$50
Arabian Nights,https://arabiannightssf.com/,San Francisco ,Mission,Mediterranean ,Staff and aesthetic. Also good seating in the back on a nice day.,Start with the MEZZA SAMPLER and order more of what you want after.,"Not required, but recommended",1-2 days should be good enough,$$ - $21-$50
Chic n' Time,https://chicntime.menu11.com/,San Francisco,Mission,"Vietnamese, Taiwanese",Amazing Vietnamese/Taiwanese fusion chicken spot. Locally owned - you can often catch the owner working the register and he's very friendly. Fast service. Perfect place to stop in for a quick bite while strolling down Valencia St.,"Peppercorn wings, five spice chicken, charbroiled beef, with garlic noodles or vermicelli rather than phở here  ",Just pull up!,"Counter serve, no reservations",$$ - $21-$50
Pakwan,https://www.pakwanrestaurant.com/,San Francisco,The mission,Indian,Food and prices — lots of vegetarian options,Anything vegetarian. I literally order something different every time I am there.,Walk-in only/no reservations,N/A,$ - $0-$20
Cote Ouest,coteouestbistro.com,San Francisco ,Marina,French,In a quiet neighborhood in the Marina. Easy to make a reservation. Small business and very authentic. The staff is French and try to greet you by name. Their food is amazing and prices are reasonable. ,Grilled Chicken Sandwich ,"Not required, but recommended",A day or 2,$$ - $21-$50
Mama Ji’s,https://www.mamajissf.com/,San Francisco,Castro,Chinese,Food is incredible and it’s a family run spot with some of the most friendly servers!,"Triple C cauliflower, Wings, or Tofu is the best thing on their menu","Not required, but recommended",No planning needed usually!,$$ - $21-$50
The Yellow Submarine,https://maps.app.goo.gl/Zj3HxDtU4t1h2D5o8,San Francisco ,Inner sunset ,Sandwich,"Family owned business, Rami and his grandma are generally working the front and make for such a fun, bustling, sub shop vibe. Cash only",Hot Pastrami Sub with 'the works'! ,Just pull up!,,$ - $0-$20
Philmore Creamery,https://maps.app.goo.gl/wS8Nj2xLUsFqCbyK7,San Francisco ,Fillmore ,Gelato,"Creamiest, most tasty gelato in SF. No questions.",Pistachio gialto and the gianduia crunch,Just pull up!,,$ - $0-$20
Cellarmaker House of Pizza,cellarmakerbrewing.com,San Francisco ,Mission,Pizza,Great pizza and Detroit style beer. Crispy cheese and great bread for the pizza. ,Red Top,Walk-in only/no reservations,,$$ - $21-$50
Khao Tiew,Na,San Francisco ,West Portal,Thai,"Great vibes, even better food",Fried squash bottom (seasonal),Walk-in only/no reservations,"Walk in only, wait is probably around 1 hour so yelp waitlist and go do something else ",$$ - $21-$50
Noodle in a Haystack,noodleinhaystack.com,San Francisco ,Inner Richmond,Japanese,"Food is great, ran by a super cute couple, small intimate setting",Set menu,"Yes, required","Very hard reservation to get, and book 1 month out. Very $$$$",$$$$ - $101 -$1000
Sriracha Thai Cuisine,https://www.srirachathaicuisineca.com/ron1e5rh/restaurant/order-online?menu=All+Day+Menu&category=Appetizers,San Francisco,Inner Sunset,Thai,"Great, affordable Thai food. They serve Khao Soi (my favorite Thai dish) which many Thai restaurants don’t offer as it’s a specialty from northern Thailand.","Khao Soi, Pad Kee Mao, Fried Spring Rolls",Just pull up!,,$ - $0-$20
Yummy Yummy,NA,San Francisco,Inner Sunset,Vietnamese,The name says it all,I always get #13 curry chicken noodle soup & spring rolls,Just pull up!,,$$ - $21-$50
DAMNFiNE Pizza,https://damnfineco.com/,San Francisco ,Outer Sunset,Italian ,"Neapolitan pizza, cocktails, back patio, everything is homemade in house  ","Meatballs, pepperoni pizza, acapulco pizza, burrata appetizer","Not required, but recommended",Would recommend a couple days for reservation. Walkin sometimes works for bar but expect to wait an hour,$$ - $21-$50
Chavela’s,https://chavelasnyc.com/,Brooklyn,Crown heights,Mexican,Has been here over 10 years and my Mexican parents approve of it and the drinks are great. It’s neighborhoody / datey / perfect for any occasion.,"Chilaquiles verdes, don pepino, special desserts 🤤🤤",Can get crowded but usually I walk in for ~4 or less.,Not sure,$$ - $21-$50
Shawarmaji,https://www.theshawarmaji.com/,Oakland,Uptown,"Palestinian, Jordanian",It’s delicious. It’s Palestinian-owned. They do things with garlic that will make you question everything. What more do you need?,Falafel. 🧆 ,Just pull up!,,$ - $0-$20
Tacos Mi Rancho,https://www.tacosmirancho.com/,Oakland,Eastlake,Mexican,"It’s cheaper than the Mission, you can sit by the lake and eat it, and it’s delicious.",Get a burrito! Get all the salsas!,Just pull up!,,$ - $0-$20
Gregory’s,https://gregorysgourmetdesserts.com/,Oakland,Oakland,Dessert,"It’s Black-owned, it’s dessert, and it’s delicious",Key lime pie or any citrus tart/pie,Just pull up!,,$ - $0-$20
Cotogna ,https://www.cotognasf.com/,San Francisco,North Beach / Embarcadero,"Italian, California","It’s so classy and tasteful without trying too hard. The space is refined, cozy, and a little romantic, with a partially open kitchen and copper pots everywhere. The pastas are handmade and always incredible—I’ve genuinely never had a bad dish here. The wine list is amazing, with a lot of really thoughtful, niche bottles, and the service is impeccable. Hyper-local ingredients, Italian technique. I’d bring someone here if they really love food, or if I wanted to impress a date in a subtle way.","Raviolo, gnocco fritto is a comfort classic. The menu rotates a lot, but those two are often on it. Great seasonal salads. ","Reservations are hard to get. I’ve always walked in, and often will sit at the bar. The waitlist is usually long but they often get you in faster than they say they will.",Often are booked a month out.,$$$ - $51-$100
Bakesale Betty,https://www.bakesalebetty.us/,Oakland,Temescal,Southern ,"Best spicy coleslaw I’ve ever had. Simple: all you can order is a fried chicken sandwich or salad. The pro move is to get it to go and walk across the street to Kingfish, a perfect dive bar, and eat your lunch on the back patio while watching a Warriors game.  ",Salad all the way!,Walk-in only/no reservations,,$ - $0-$20
El Tío Juan Taco Truck,https://www.facebook.com/profile.php?id=100063701839664&mibextid=wwXIfr,Oakland,Fruitvale,Mexican ,Low key taco truck with amaaazing food. I always take friends that visit to this spot and it’s one of those places that you take your first bite and forget where you’re at. Eventually you look up and realize no one has been talking because they’re all lost in the sauce of the food experience ,"Sope al pastor and torta de milanesa. If you’ve never had a sope, this is the place to convert. I’ve never had a torta on a ciabatta bread before this but - I see the vision ",Just pull up!,,$ - $0-$20
Flour & Branch,https://www.flourandbranch.com/,San Francisco ,SOMA,Bakery ,Skip the fancy lattes here and go straight to all the desserts. You can’t leave without trying their soft baked cookies - they are the best!,All the soft baked cookies!,Walk-in only/no reservations,No,$ - $0-$20
Dad’s luncheonatte ,https://www.dadsluncheonette.com/,San Francisco ,Half moon bay ,Californian,Very casual and off the side of the road - food made and served from a historic train caboose. Chef is ex Michelan and the food is amazing!!!! ,Don’t miss out on the mushroom sandwich and Mac n cheese,Food served till they run out so plan to go early,No reservation but just don’t plan to show up close to when they shut down as they will run out of food!,$ - $0-$20
Mr. Pollo,https://www.instagram.com/mrpollosf?igsh=MzRlODBiNWFlZA==,San Francisco ,Mission,Colombian,"Staff is amazing, space is funky and fun, food is great! ""Mr Pollo offers a 4 course tasting menu that changes often. We source from local farmers and have a beer and wine list to match our food. Reservations are a must as there are only 12 seats and fill up quickly.",Set menu,"Yes, required","Depends on the day, 1 week to 1 month ish ",$$ - $21-$50
Kingdom of Dumpling,https://www.google.com/search?sca_esv=90ecd7b778e2c380&rlz=1CDGOYI_enUS1014US1014&hl=en-US&sxsrf=AE3TifMa_iWnfxw9OVM2PGdu-sfseaRNmQ%3A1767096454695&kgmid=%2Fg%2F11mns10619&q=Kingdom%20Of%20Dumpling&shndl=30&shem=ptotple&source=sh%2Fx%2Floc%2Fact%2Fm4%2F3,San Francisco,Sunset,Chinese,"Absolute hole in the wall with the best Chinese food in San Francisco, unbelievable sauces and flavors, super affordable, right off the L train, and everyone we bring here becomes as obsessed as us. If we could only eat at one restaurant in the city for the rest of our lives, this would be it.","Shanghai soup dumplings, spicy green beans, Dan Dan noodles, spicy wontons. It’s a perfect order. Don’t reduce, only add to it!",Just pull up!,,$ - $0-$20
Villa Berullia,https://villaberulia.com/,NYC,Midtown East,Italian,"Old school Italian af! Waitstaff will occasionally bring you food they’re just working on in the kitchen, the martinis are crisp, the ambiance is next level Goodfellas, and the food MY GOD the food! The most tender osso bucco on the planet! ","The osso bucco, a dirty martini, any vodka based pasta","Not required, but recommended",Probably 3-4 days out,$$$ - $51-$100
Rite Spot Cafe,ritespotcafe.net,San Francisco,Mission ,Italian,Super local spot with live music every night! It’s an interesting of white table cloth Italian/dive bar. Affordable pricing on solid pasta dishes and super friendly bartenders. You’ll definitely hear some stories about old SF. ,"Popcorn Chicken happy meal, Brussels sprouts and the meatballs! ",Walk-in only/no reservations,"No need, just get there a bit before the show starts before all the locals take the good tables! ",$$ - $21-$50
Chris & Sons Roti Shop and Bakery,https://www.instagram.com/chrisandsonsrotishop/?hl=en,NYC,"Hollis, Queens",Trinidadian,"Good local spot for Caribbean eats (curry, roti, trini pastries, etc.).",Curry chicken roti,Just pull up!,N/A,$ - $0-$20
Om Sabor,https://omsabor.com/,San Francisco,Hayes Valley,"Vegan, Latin","Best vegan food in the city, super creative and tasty, nicest chefs, under the radar.","The menu changes but if they have the crab cakes or hibiscus tacos, absolutely get both.",Just pull up!,,$$ - $21-$50
Tahona Mercado,https://tahonamercado.com/,San Francisco ,Nob Hill,Mexican ,Specialty grocer/bottle shop that also sells delicious tacos/tortas with counter seating ,Best carnitas in SF; mushroom taco ,Just pull up!,N/A but tortas sell out early ,$ - $0-$20
Black Horse London Pub,mariewfawcett@gmail.com,San Francisco ,Cow Hollow,"Pub, bar food ","I love the hilarious owner, regulars, rowdy and welcoming in a teeny tiny space. Old school SF ",Alcohol in a brown paper bag ,"No reservations, but gets full",N/A,$$ - $21-$50
Tommy’s Mexican Restaurant ,tommysmexican.com,San Francisco,Outer Richmond,Mexican,"Hands down best chips/salsa and tequila selection in the city. Family owned for over 50 years and original Tommy’s Margarita. Great vibe. If you’re feeling tough try their spicy tequila challenge, but be warned now it’s 🔥🔥",Chips and salsa. Tommy’s Marg. Yucatán Tamale,Just pull up!,,$$ - $21-$50
Eyval,https://www.eyvalnyc.com/,New York ,Bushwick,Persian ,"It’s a great mix of traditional and modern takes on Persian food - accessible to the yts and non Persians, and ~* trendy enough to entice folks to try something new ","Kashke Bademjan , masto musir for apps. Kabob koobideh and the lamb ribs for entrees. Try ghormeh sabzi too and don’t forget to ask for the tadig (crispy rice) in case they have any available !","Not required, but recommended",Literally weeks for prime reservation slots  - put on resy notifications! ,$$$ - $51-$100
Limón,limonrestaurants.com,San Francisco ,Mission in SF,Peruvian,"Amazing for groups, fantastic Peruvian food (ceviche, empanadas,) also rotisserie chicken and truffle mac. Super quick and great service every time!","Sangria, half chicken, truffle Mac & cheese, ceviche","Not required, but recommended",,$$ - $21-$50
Pho 2000,pho2000.net,San Francisco,Tenderloin,Vietnamese ,"Amazinggg Pho! Cute vibe, worth the Tenderloin trip!",Beef or chicken pho is delicious!,Walk-in only/no reservations,Expect to wait 15 min or so if you go at a busy time (aka a weekend meal time),$ - $0-$20
Kezar Pub,thekezarpub.shop,San Francisco,Haight-Ashbury,Pub food,"Right near Golden Gate Park, great bar/pub. But HAVE to get the buffalo wings.","Buffalo wings, best in SF!",Just pull up!,,$$ - $21-$50
Kayo’s Ramen Bar,https://kayosramen.com/,Portland,Northeast,Japanese,This place brought me out of Oregon seasonal depressive disorder in the depths of PWN winter. I used to drive 2 hours for this ramen in college. Great location and cute shopping around it too. ,The tan tan broth with pork helped my frontal lobe fully develop. Honorable mention for the Japanese tacos. ,"Not required, but recommended",,$ - $0-$20
Homeroom,https://www.homeroom510.com/,Oakland,Mosswood/Temescal,American,Tons of variations on a classic dish everyone loves. ,Gilroy Garlic Mac ,Just pull up!,,$ - $0-$20
Cafe Romanat ,https://maps.app.goo.gl/nbaiJWN53xo1kHaQ8?g_st=ic,Oakland ,Grand Lake,Ethiopian/Eritrean ,The food is so authentic and hasn’t charged the last 10 years. Family owned and operated.,Quanta Firfir,Just pull up!,,$$ - $21-$50
Soothr,https://www.soothrnyc.com/,New York ,Lower east,Thai,,"Beef ribs,","Yes, required",,$$ - $21-$50
Pio Pio,https://www.piopio.shop/,New York ,Manhattan,Peruvian,Incredible chicken. Truly some of my favorite in the world. ,1/2 chicken with rice and beans,Just pull up!,,$$ - $21-$50
Eiji,NA,San Francisco,Castro,Japanese,"Small, hole in the wall Japanese place in the Castro that is cozy and inviting!",The sushi is fine but the homemade tofu is TO DIE FOR -- I feel that their main dishes that aren't sushi are the realm winners.,Walk-in only/no reservations,,$$ - $21-$50
El Gallo Giro Food Truck,NA,San Francisco,Mission,Mexican,The people that run this truck are so kind and the tacos are the best in the city.,Carnitas and carne asada tacos are always winners.,Just pull up!,The truck sets up at 23rd and Treat M-F until 5pm and can be a bit elusive.,$ - $0-$20
Gus' Market,https://gussmarket.com/,San Francisco,"Mission, Outer Sunset",Sandwich,"Gus' is a local market with spots around the city, but they have really good sandwiches if you're looking for something quick!",The 1906 sandwich on Dutch Crunch is something I dream about. DO NOT ORDER FROM THE HAIGHT LOCATION -- something ain't right there wrt the sandos.,Just pull up!,,$ - $0-$20
Pho 2000,http://pho2000.net/,San Francisco,Tenderloin,Vietnamese,"Hole in the wall, but the pho is amazing and it's open for breakfast if you're into that!",Phở Tái or Phở Tái nạm,Walk-in only/no reservations,,$ - $0-$20
Rossi's Deli,http://www.rossisdeli.net/,San Francisco,Castro,Middle Eastern,Great deli in the Castro with super funny people running the counter who WILL JUDGE YOU IF YOU DO NOT ORDER SPICY.,Falafel deluxe sandwich SPICY -- they WILL judge you openly if you do not get it spicy (it's not too hot).,Just pull up!,,$ - $0-$20
Judahlicious,http://www.judahlicious.com/,San Francisco,Outer Sunset,"Californian, Vegan","Super small, but quick with the orders. Everything is vegan, but you wouldn't guess it. ",No shirt no shoes or half nekked burrito,Just pull up!,,$ - $0-$20
S’mac,https://www.eatsmac.com/,Manhattan,East Village,American,The food- according to my bf “order anything and it’s going to be great”,"We get the vegan options (the “nosh” size is filling but go for the “major munch” if you’re hungry) his order- mac and cheese, breadcrumbs, garlic and beef; her order: mac and cheese, extra breadcrumbs, parsley, rosemary and garlic ",Just pull up!,N/A,$ - $0-$20
Empanada Mama,https://www.empanadamama.com/hells-kitchen,Manhattan,Hell’s Kitchen,"Colombian, Latin",THE FOOD IS SO GOOD,"Wheat Empanadas - Viagra, Brasil; Corn Empanada - Portobello; LENTIL SOUP WITH AVOCADO. GREEN SAUCE IS A REQUIREMENT FOR THE EMPANADAS!! The churros are great too if you have space. We usually get a few of each empanada",Just pull up!,NA,$ - $0-$20
Taqueria San Bruno,taqueriasanbruno.net,San Bruno,San bruno,Mexican,"This is the best al pastor I have had in my life as a Mexican American who has been to Mexico many times and lived in both the bay and LA. You will wait over 20 min for food, it’s on a street with nothing but warehouses but it’s so worth it. There are always people there and it’s amazing to buy a beer and wait at a table or hell, just in your car or on the curb for this food. I wish it were nearer so I could go every week.",AL PASTOR,Just pull up!,Just make sure theyre open!,$ - $0-$20
OSHA Thai ,https://oshathai.com/embarcadero/,San Francisco ,Embarcadero/FIDI,Thai,"You’re in FiDi or Embarcadero, you need something yummy, not fancy but still a good atomosphere and proper service. It’s like Goldilocks’ porridge, hard to find something that fits all of these boxes but OSHA is IT. Plus it’s delicious Thai in a city that needs more delicious Thai. ","Pumpkin curry, pad Thai sunrise, all the appetizers, fresh coconut ",Just pull up!,No planning which is part of why it’s awesome ,$$ - $21-$50
The Morris,https://themorris-sf.com/,San Francisco,Mission,French Californian,Vibes are immaculate. Wine list is sensational. Menu is unique and well executed.,Off-menu burger and the duck.,"Not required, but recommended",One week,$$$$ - $101 -$1000
Uva Enoteca,https://www.uvaenoteca.com/menu/,San Francisco ,Lower Haight,Italian ,"The food is great and the owner Antonio is so friendly and welcoming, he always has great suggestions and tells you all about where he’s sourced ingredients. Great for a full dinner or afternoon glass of wine at the bar, you’ll usually get a few snacks thrown in. ",The pasta and apps never miss,Just pull up!,,$$ - $21-$50
Kibatsu,https://www.kibatsusushi.com/,San Francisco ,Lower haight ,Japanese ,"The coziest little restaurant, everyone is so friendly and the sushi is delightful and very well priced for the quality. ",Nigiri ,"Not required, but recommended",If there’s two of you you can pretty much always walk in. Make a res for bigger groups. ,$$$ - $51-$100
Dancing Yak,https://dancingyaksf.com/,San Francisco,Mission,Nepalese,Incredible food and cocktails! Great for small group dinners and they have a big back room for private events. ,Kale Chaat!,"Not required, but recommended",Not far,$$ - $21-$50
El Chato,https://www.elchatosf.com/,San Francisco,Mission,Spanish,"Great vibes for a casual hang with friends. Order a bottle of wine, tapas, and hang out for a while. Often has live music too.",Try a vermouth! Also can’t go wrong with some Jamon and Pan con Tomate,Just pull up!,,$$ - $21-$50
Cha Cha Cha,https://www.chachachasf.com/,San Francisco,Haight,Cuban/Caribbean ,"The sauces are world-class, the sangria is glorious. The decor is gaudy and unique.","Cajun shrimp, Chicken Pillard, warm spinach salad, plantains ",Walk-in only/no reservations,,$$ - $21-$50
Cordon Bleu Vietnamese Restaurant,NA,San Francisco,Nob Hill,Vietnamese,Wellllll - I went here hundred times and it was choice,Honsestly don’t remember - but the lady who owns this will sort you,Just pull up!,Nada nada limonada,$$ - $21-$50
Yuanbao Jiaozi,https://yuanbaojiaozisf.com/,San Francisco,Inner Sunset,Chinese,"Handmade, SUPER fresh dumplings. Small menu with all items elite. Also they sell most of dumplings frozen to go so you can cook them later",The classic pork dumpling,Walk-in only/no reservations,,$ - $0-$20
